{
  "$schema": "http://json-schema.org/draft-07/schema#",
  "title": "Benutzer Schema",
  "description": "Schema für die Benutzerkonfigurationen",
  "type": "array",
  "items": {
    "type": "object",
    "properties": {
      "user": {
        "type": "string",
        "description": "Eindeutiger Benutzername",
        "minLength": 1
      },
      "name": {
        "type": "string",
        "description": "Vollständiger Name des Benutzers",
        "minLength": 1
      },
      "icon": {
        "type": "string",
        "description": "Dateiname des Benutzer-Icons (z.B. 'benutzer.jpg')",
        "pattern": "^[a-zA-Z0-9_-]+\\.(jpg|jpeg|png|svg|gif|webp)$"
      },
      "pin": {
        "type": "string",
        "description": "Optionale 4-stellige PIN",
        "pattern": "^\\d{4}$"
      }
    },
    "required": [
      "user",
      "name",
      "icon"
    ],
    "additionalProperties": false
  }
}
